{
  "$schema": "https://json-schema.org/draft/2020-12/schema",
  "$id": "https://prisminfer.local/schemas/ggml_tensor_eligibility.schema.json",
  "type": "object",
  "additionalProperties": false,
  "required": ["map_version", "artifact_sha256", "artifact_bytes", "producer_repository", "producer_revision", "parser_semantics_revision", "decoder_build_binding_sha256", "oracle_source_sha256", "source_repository", "source_revision", "inventory_sha256", "retained_slice_manifest_sha256", "tensor_count", "observed_types", "selection_rule", "claim_boundary"],
  "properties": {
    "map_version": { "const": "packet-a-ggml-eligibility-v1" },
    "artifact_sha256": { "const": "7b064f5842bf9532c91456deda288a1b672397a54fa729aa665952863033557c" },
    "artifact_bytes": { "const": 4920739232 },
    "producer_repository": { "const": "bartowski/Meta-Llama-3.1-8B-Instruct-GGUF" },
    "producer_revision": { "const": "bf5b95e96dac0462e2a09145ec66cae9a3f12067" },
    "parser_semantics_revision": { "const": "13f2b28b098623391b1aacfd27995e1c8b7de9a9" },
    "decoder_build_binding_sha256": { "const": "0a61aecdc5092b3779235730f9ad9ca457b7f5fbaf0a9281219b3b47d801e3f5" },
    "oracle_source_sha256": {
      "type": "object", "additionalProperties": false, "required": ["gguf_reader.py", "quants.py"],
      "properties": {
        "gguf_reader.py": { "const": "91cb9e81f1a67f5856f012cf3f526ad9ffdb6b887d2aa66e2593ee6f63764aad" },
        "quants.py": { "const": "2c927a1b3d9f0920dcf4007fb686e1b0999333e9f65ce43dcc689900c0beae8b" }
      }
    },
    "source_repository": { "const": "meta-llama/Llama-3.1-8B-Instruct" },
    "source_revision": { "const": "0e9e39f249a16976918f6564b8830bc894c89659" },
    "inventory_sha256": { "const": "e49ef5d6b443965f8a1f89a4d9ccc6b01809e3b4117ce1120243772cb957df15" },
    "retained_slice_manifest_sha256": { "const": "ec785e66d759a9c7eb1e7c85d2e31e8293bb2fc7a6b1fee3fe4674420c0c2cd9" },
    "tensor_count": { "const": 292 },
    "observed_types": { "const": [
      { "ggml_type": "F32", "tensor_count": 66, "type_id": 0, "block_elements": 1, "block_bytes": 4, "pinned_semantics": "llama.cpp 13f2b28 ggml/src/ggml.c and gguf-py/gguf/quants.py IEEE-754 little-endian F32", "cpu_reference": "byte-identical IEEE-754 F32 retained-slice comparison", "custom_path_eligible": false, "runtime_route": "pinned-upstream-fallback" },
      { "ggml_type": "Q4_K", "tensor_count": 193, "type_id": 12, "block_elements": 256, "block_bytes": 144, "pinned_semantics": "llama.cpp 13f2b28 ggml/src/ggml-quants.c dequantize_row_q4_K", "cpu_reference": "prisminfer::kernels::decode_ggml_q4_k_reference", "custom_path_eligible": true, "runtime_route": "bounded-custom-cpu-reference-or-pinned-upstream-fallback" },
      { "ggml_type": "Q6_K", "tensor_count": 33, "type_id": 14, "block_elements": 256, "block_bytes": 210, "pinned_semantics": "llama.cpp 13f2b28 ggml/src/ggml-quants.c dequantize_row_q6_K", "cpu_reference": "prisminfer::kernels::decode_ggml_q6_k_reference", "custom_path_eligible": false, "runtime_route": "pinned-upstream-fallback" }
    ] },
    "selection_rule": { "const": "Every observed type is enumerated; unlisted types fail admission and all non-eligible tensors route to pinned upstream fallback." },
    "claim_boundary": { "const": "CPU/offline decoding truth only; no CUDA, inference, calibration, benchmark, or performance claim" }
  }
}
